{
  "$schema": "https://json-schema.org/draft/2020-12/schema",
  "$id": "https://rechtspraak.nl/jrem/schema/v1.0.0",
  "title": "Judicial Rule Exchange Model (JREM)",
  "description": "Neutraal uitwisselmodel voor juridische regels. Primair contract tussen RegelSpraak specificatie en Rule API.",
  "type": "object",
  "additionalProperties": false,
  "required": [
    "schemaVersion",
    "ruleSetId",
    "version",
    "validFrom",
    "validUntil",
    "jurisdiction",
    "domain",
    "procedureType",
    "rules"
  ],
  "properties": {
    "schemaVersion": {
      "type": "string",
      "description": "Versie van het JREM-schema zelf",
      "pattern": "^\\d+\\.\\d+\\.\\d+$"
    },
    "ruleSetId": {
      "type": "string",
      "description": "Unieke identificatie van de ruleset"
    },
    "version": {
      "type": "string",
      "description": "Versie van de tariefset",
      "pattern": "^\\d{4}\\.\\d+$"
    },
    "validFrom": {
      "type": "string",
      "format": "date",
      "description": "Geldig vanaf (ISO 8601 datum)"
    },
    "validUntil": {
      "type": [
        "string",
        "null"
      ],
      "format": "date",
      "description": "Geldig tot en met (ISO 8601 datum)"
    },
    "jurisdiction": {
      "type": "string",
      "description": "Jurisdictie (ISO 3166-1 alpha-2)"
    },
    "domain": {
      "type": "string",
      "enum": [
        "civiel-rechtbank",
        "civiel-gerechtshof",
        "bestuursrecht",
        "strafrecht",
        "rechtspraak-publicatie",
        "basisregistraties",
        "bio2-informatiebeveiliging",
        "forumstandaardisatie",
        "overheidsstandaarden",
        "nora-architectuur",
        "omgevingswet",
        "eu-ai-act",
        "avg-gdpr",
        "ncsc-cybersecurity",
        "nis2",
        "btw-tarieven",
        "toeslagen",
        "participatiewet",
        "ww-uitkering",
        "ind-verblijfsregels",
        "wmo",
        "gegevensdelingsbeleid",
        "dpia-model",
        "algoritmeregister",
        "data-overheid-dcat",
        "api-registratie",
        "dienstverlening-check",
        "traceability",
        "compliance-debt",
        "regulatory-impact",
        "decentrale-regelcheck",
        "woo-publicatieplicht-preflight",
        "sttr-preflight",
        "judicial-ai-assurance",
        "itgc-kader",
        "eidas",
        "bia-biv-dpia",
        "dpia-generator",
        "iso27001",
        "wdo",
        "iso25010",
        "iso27002",
        "iso27701",
        "iso22301",
        "iso31000",
        "iso9001",
        "nen7510",
        "nist-csf",
        "iso20000",
        "pci-dss",
        "cobit",
        "soc2",
        "iso14001",
        "iso45001",
        "nis2-volledig",
        "bdi",
        "wdo-uitbreiding",
        "algoritmeregister-fria"
      ]
    },
    "procedureType": {
      "type": "string",
      "enum": [
        "dagvaarding",
        "verzoek",
        "kort-geding",
        "cassatie",
        "activiteit-toetsing",
        "bijstandsberekening",
        "toegangsbeoordeling",
        "toeslagen-berekening",
        "decentrale-regelcheck",
        "woo-publicatieplicht-preflight",
        "sttr-preflight",
        "judicial-ai-assurance",
        "itgc-kader",
        "eidas-compliance"
      ]
    },
    "conflictResolution": {
      "type": "string",
      "enum": [
        "first-match",
        "highest-priority",
        "manual"
      ]
    },
    "rules": {
      "type": "array",
      "minItems": 1,
      "items": {
        "type": "object",
        "additionalProperties": false,
        "required": [
          "ruleId",
          "name",
          "priority",
          "sourceRefs",
          "conditions",
          "outcome"
        ],
        "properties": {
          "ruleId": {
            "type": "string",
            "description": "Unieke identificatie van de regel"
          },
          "name": {
            "type": "string",
            "description": "Leesbare naam van de regel"
          },
          "priority": {
            "type": "integer",
            "minimum": 0,
            "maximum": 1000,
            "description": "Prioriteit: hoger = eerder geëvalueerd bij first-match"
          },
          "legalStatus": {
            "type": "string",
            "enum": [
              "wettelijk",
              "regeling",
              "conventie"
            ],
            "description": "Juridische status van de regel"
          },
          "sourceRefs": {
            "type": "array",
            "minItems": 1,
            "items": {
              "type": "object",
              "additionalProperties": false,
              "required": [
                "type",
                "title"
              ],
              "properties": {
                "type": {
                  "type": "string",
          "enum": [
            "wetsartikel",
            "wet",
            "besluit",
            "standaard",
            "regeling",
            "rechtspraak-tarieftabel",
            "procesreglement",
            "jurisprudentie",
            "beleid"
          ]
                },
                "title": {
                  "type": "string"
                },
                "section": {
                  "type": "string"
                },
                "url": {
                  "type": "string",
                  "format": "uri"
                },
                "bwbId": {
                  "type": "string"
                },
                "celexId": {
                  "type": "string"
                },
                "eli": {
                  "type": "string",
                  "format": "uri"
                },
                "bronVersie": {
                  "type": "string",
                  "description": "Identifier of datum van de exact gebruikte bronversie"
                },
                "bronDatum": {
                  "type": "string",
                  "format": "date"
                },
                "retrievedOn": {
                  "type": "string",
                  "format": "date"
                }
              }
            }
          },
          "conditions": {
            "type": "object",
            "additionalProperties": true,
            "properties": {
              "zaakstroom": {
                "type": "array",
                "items": {
                  "type": "string",
                  "enum": [
                    "kanton",
                    "handel"
                  ]
                }
              },
              "rol": {
                "type": "array",
                "items": {
                  "type": "string",
                  "enum": [
                    "eiser",
                    "gedaagde",
                    "verzoeker",
                    "verweerder"
                  ]
                }
              },
              "partijType": {
                "type": "array",
                "items": {
                  "type": "string",
                  "enum": [
                    "natuurlijk_persoon",
                    "niet_natuurlijk_persoon",
                    "onvermogend"
                  ]
                }
              },
              "verweerStatus": {
                "type": "array",
                "items": {
                  "type": "string",
                  "enum": [
                    "niet_ingediend",
                    "ingediend",
                    "onbekend",
                    "n.v.t."
                  ]
                }
              },
              "bijzondereCategorie": {
                "type": "array",
                "items": {
                  "type": "string",
                  "enum": [
                    "geen",
                    "whoa",
                    "depot",
                    "akte"
                  ]
                }
              },
              "vorderingWaarde": {
                "oneOf": [
                  {
                    "type": "string",
                    "enum": [
                      "onbepaald"
                    ]
                  },
                  {
                    "type": "object",
                    "additionalProperties": false,
                    "properties": {
                      "gt": {
                        "type": "number",
                        "minimum": 0
                      },
                      "gte": {
                        "type": "number",
                        "minimum": 0
                      },
                      "lt": {
                        "type": "number",
                        "minimum": 0
                      },
                      "lte": {
                        "type": "number",
                        "minimum": 0
                      }
                    },
                    "minProperties": 1
                  }
                ]
              }
            }
          },
          "outcome": {
            "type": "object",
            "additionalProperties": true,
            "properties": {
              "griffierecht": {
                "type": "object",
                "additionalProperties": false,
                "required": [
                  "amount",
                  "currency"
                ],
                "properties": {
                  "amount": {
                    "type": [
                      "number",
                      "null"
                    ],
                    "minimum": 0,
                    "description": "Griffierecht bedrag in euro's, of null indien niet van toepassing"
                  },
                  "currency": {
                    "type": "string",
                    "enum": [
                      "EUR"
                    ]
                  }
                }
              },
              "category": {
                "type": "string",
                "description": "Tariefcategorie"
              },
              "confidence": {
                "type": "string",
                "enum": [
                  "deterministic",
                  "probabilistic"
                ]
              },
              "manualReviewRequired": {
                "type": "boolean"
              },
              "manualReviewReason": {
                "type": "string"
              }
            }
          },
          "examples": {
            "type": "array",
            "items": {
              "type": "object",
              "additionalProperties": false,
              "required": [
                "input"
              ],
              "properties": {
                "input": {
                  "type": "object",
                  "additionalProperties": true
                },
                "expectedAmount": {
                  "type": "number",
                  "minimum": 0
                }
              }
            }
          }
        }
      }
    },
    "scenarios": {
      "type": "array",
      "items": {
        "type": "object",
        "additionalProperties": false,
        "required": [
          "id",
          "description",
          "input",
          "expected"
        ],
        "properties": {
          "id": {
            "type": "string"
          },
          "description": {
            "type": "string"
          },
          "input": {
            "type": "object",
            "additionalProperties": true,
            "required": [
              "rechtsgebied",
              "zaakstroom",
              "procedureType",
              "vorderingWaarde"
            ],
            "properties": {
              "rechtsgebied": {
                "type": "string"
              },
              "zaakstroom": {
                "type": "string"
              },
              "procedureType": {
                "type": "string"
              },
              "vorderingWaarde": {
                "type": [
                  "number",
                  "string"
                ]
              },
              "bijzondereCategorie": {
                "type": "string"
              },
              "rol": {
                "type": "string"
              },
              "partijType": {
                "type": "string"
              },
              "onvermogend": {
                "type": "boolean"
              },
              "verweerStatus": {
                "type": "string"
              }
            }
          },
          "expected": {
            "type": "object",
            "additionalProperties": false,
            "required": [
              "griffierecht",
              "category",
              "appliedRules"
            ],
            "properties": {
              "griffierecht": {
                "type": ["number", "null"],
                "minimum": 0
              },
              "category": {
                "type": "string"
              },
              "appliedRules": {
                "type": "array",
                "items": {
                  "type": "string"
                }
              },
              "manualReviewRequired": {
                "type": "boolean"
              }
            }
          }
        }
      }
    },
    "transitionRules": {
      "type": "array",
      "items": {
        "type": "object",
        "additionalProperties": false,
        "required": [
          "from",
          "to",
          "effectiveDate",
          "description"
        ],
        "properties": {
          "from": {
            "type": "string"
          },
          "to": {
            "type": "string"
          },
          "effectiveDate": {
            "type": "string",
            "format": "date"
          },
          "description": {
            "type": "string"
          }
        }
      }
    },
    "metadata": {
      "type": "object",
      "additionalProperties": false,
      "description": "Optionele metadata voor juridische context en acceptatie",
      "properties": {
        "juridischeContext": {
          "type": "object",
          "additionalProperties": false,
          "properties": {
            "wet": {
              "type": "string"
            },
            "wetBwbrId": {
              "type": "string"
            },
            "wetVersieLaatstGecheckt": {
              "type": "string",
              "format": "date"
            },
            "tariefVersie": {
              "type": "string"
            }
          }
        },
        "juristAccordering": {
          "type": "object",
          "additionalProperties": false,
          "properties": {
            "geaccondeerdDoor": {
              "type": "string"
            },
            "datum": {
              "type": "string",
              "format": "date"
            },
            "geldigTot": {
              "type": "string",
              "format": "date"
            },
            "versie": {
              "type": "string"
            },
            "rol": {
              "type": "string"
            },
            "organisatie": {
              "type": "string"
            },
            "scope": {
              "type": "string"
            },
            "bronSnapshot": {
              "type": "string"
            },
            "verklaring": {
              "type": "string"
            },
            "beperkingen": {
              "type": "array",
              "items": {
                "type": "string"
              }
            }
          }
        },
        "bronverificatieDatum": {
          "type": "string",
          "format": "date"
        },
        "acceptatieType": {
          "type": "string",
          "enum": [
            "draft",
            "full",
            "update"
          ]
        },
        "indicatorDisclaimer": {
          "type": "string"
        },
        "manualReviewBoundary": {
          "type": "string",
          "enum": [
            "indicator-only"
          ]
        }
      }
    },
    "governanceLevel": {
      "type": "string",
      "enum": [
        "eu",
        "rijk",
        "provincie",
        "gemeente",
        "waterschap"
      ],
      "description": "Bestuursniveau"
    },
    "approval": {
      "type": "object",
      "additionalProperties": false,
      "required": [
        "type",
        "reviewer",
        "role",
        "date",
        "scope",
        "limitations"
      ],
      "properties": {
        "type": {
          "type": "string",
          "enum": [
            "self",
            "jurist",
            "independent"
          ]
        },
        "reviewer": {
          "type": "string"
        },
        "role": {
          "type": "string"
        },
        "date": {
          "type": "string",
          "format": "date"
        },
        "scope": {
          "type": "string"
        },
        "limitations": {
          "type": "array",
          "items": {
            "type": "string"
          }
        }
      }
    },
    "maturityLevel": {
      "type": "string",
      "pattern": "^L[0-4]-[a-z0-9-]+$"
    }
  }
}
